"ID","title","abstract","authors","date","category","doi","version","author_corresponding","author_corresponding_institution","link_page","link_pdf","license","published","data_avail","decision"
60,"A Needs Analysis of Parents Following Sudden Cardiac Death in the Young","The sudden cardiac death (SCD) of a young person is a devastating event for any parent. Inherited heart disease is often either identified or assumed to be the cause. Few studies have explored the psychosocial impact to the surviving at-risk family members. We sought to investigate the needs of parents who have experienced the SCD of their child ([&le;]45 years). A quantitative needs analysis questionnaire was developed based on semi-structured interviews, including one focus group, and a review of relevant literature. There were 38 parents who completed a cross-sectional quantitative survey. Parents perceived needs for information and support spanned medical, psychosocial, spiritual and financial domains. Medical information and support needs were identified as the most important domains, followed by psychosocial, spiritual and financial information and support needs. Importantly, psychosocial information and support needs were reported as the most unmet need, endorsed by 54% of parents. Medical information and support needs were reported as unmet by almost one third of parents. The two most endorsed needs were ''To have the option of whether or not you would pursue genetic testing for yourself or family members'' and ''To understand what happened''. This work demonstrates for the first time, the multifactorial needs of parents after SCD in the young. With the greatest unmet need reported as psychosocial needs, there is clear necessity to find ways of integrating psychological support in to the care of families after SCD in the young.","Mcdonald, K.; Sharpe, L.; Yeates, L.; Semsarian, C.; Ingles, J.",20190703,"Cardiovascular Medicine","10.1101/19000877",1,"Jodie Ingles","Centenary Institute, The University of Sydney","https://www.medrxiv.org/content/10.1101/19000877v1?versioned=TRUE","https://www.medrxiv.org/content/10.1101/19000877v1.full.pdf","cc_no",NA,"Data will be provided upon request to the corresponding author.",2
61,"Accuracy of ECG Chest Electrode Placements by Paramedics; an observational study","Background: The use of the 12-lead ECG is common in UK paramedic practice but its value depends upon accurate placement of the ECG-electrodes. Several studies have shown widespread variation in the placement of chest electrodes by other health professionals but no studies have addressed the accuracy of paramedics. The main objective of this study was to ascertain the accuracy of the chest lead placements by registered paramedics. Methods: Registered paramedics who attended the Emergency Services Show in Birmingham in September 2018 were invited to participate in this observational study. Participants were asked to place the chest electrodes on a male model in accordance with their current practice. Correct positioning was determined against the Society for Cardiological Science & Technology's Clinical Guidelines for recording a standard 12-lead electrocardiogram (2017) with a tolerance of 19mm being deemed acceptable based upon previous studies. Results: 52 eligible participants completed the study. Measurement of electrode placement in the craniocaudal and mediolateral planes showed a high level of inaccuracy with 3/52 (5.8%) participants able to accurately place all chest leads. In leads V1 - V3, the majority of incorrect placements were related to vertical displacement with most participants able to identify the correct horizontal position. In V4, the tendency was to place the lead too low and to the left of the pre-determined position whilst V5 tended to be below the expected positioning but in the correct horizontal alignment. There was a less defined pattern of error in V6 although vertical displacement was more likely than horizontal displacement. Conclusion: Our study identified a high level of variation in the placement of chest ECG electrodes which could alter the morphology of the ECG. From a patient safety perspective, we would advocate that paramedics leave the chest electrodes in situ to allow hospital staff to assess the accuracy of the placements.","Gregory, P.; Lodge, S.; Kilner, T.; Paget, S.",20190703,"Emergency Medicine","10.1101/19001321",1,"Pete Gregory","University of Wolverhampton","https://www.medrxiv.org/content/10.1101/19001321v1?versioned=TRUE","https://www.medrxiv.org/content/10.1101/19001321v1.full.pdf","cc_no","10.29045/14784726.2019.12.4.3.51","The data are deidentified participant data and will be available from Pete Gregory: pete.gregory@wlv.ac.uk. Data will be available immediately following publication and available for five years. The study protocol, consent forms and participant information sheets will also be made available on request.",2
63,"Show solidarity with the Congolese people in the 10th Ebola outbreak declared a health emergency of international concern: understand a qualitative study of variables of hospital activities on infection control practices in Kinshasa city","Health workers play an important role during epidemics, but there is limited research on hospital activities on infection control practices in the Democratic Republic of the Congo and how health workers can cope during a probable health epidemic in Kinshasa city. The determinants of the current Ebola Virus Disease in the geographical distribution remain poorly understood. The World Health Organization's Health Regulation Committee decided on Wednesday July 17th, 2019 to declare the Ebola haemorrhagic fever epidemic in the provinces of North Kivu and Ituri as a health emergency of international concern. The country struggles to control it against a backdrop of a health system that is already overburdened. To test the influence of the challenges of a contamination in the context of an Ebola outbreak that may face health workers and their coping strategies in thirteen hospitals of reference in Kinshasa, we conducted a survey hoping to educate or remember good practices for health workers in Kinshasa that is also available for health workers in the East Area of the country in which the ongoing Ebola outbreak progress is spreading (North Kivu and Ituri). For the ongoing outbreak, we obtained data from the Ministry of Health of the Democratic Republic of the Congo where cases are classified as suspected, probable, or confirmed using national case definitions. We found that the ongoing Ebola virus outbreak in the Democratic Republic of the Congo has similar epidemiological features to previous Ebola virus disease outbreak in Sierra Leone that was well described. For the qualitative study about the biosecurity in thirteen hospitals of reference in Kinshasa, we found that the Bondeko-Ngaliema Monkole group has occupied the first rank, while the group Kintambo-King Baudouin-Ndjili-Makala occupied the other end of the scale; the other health facilities occupied an intermediate position. Among the 7 hospitals which were placed at the top of this classification of biosecurity, 5 were massively subsidized by international NGO, which explains to a great extent their performances in one hand, another hand finding its explanation in the quality of their management. It is the case of Bondeko, Monkole, Kalembe-Lembe, St Joseph and Kingasani 2. Keywords: Health workforce, Biosecurity, Epidemic, Democratic Republic of the Congo","Tshima, G. K.; Kalala, K. T.",20190723,"Epidemiology","10.1101/19000539",2,"Guyguy Kabundi Tshima","Universite de Kinshasa","https://www.medrxiv.org/content/10.1101/19000539v2?versioned=TRUE","https://www.medrxiv.org/content/10.1101/19000539v2.full.pdf","cc_by",NA,"The dataset is available in the manuscript in tables. Add information on the ongoing Ebola outbreak is available from the corresponding author on reasonable request.",2
64,"Liver function tests and fibrosis scores in a rural population in Africa: estimation of the burden of disease and associated risk factors","Introduction: Liver disease is a major cause of morbidity and mortality in sub-Saharan Africa. However, its prevalence, distribution and aetiology have not been well characterised. We examined liver function tests (LFTs) and calculated liver fibrosis scores in a rural population in Uganda. Methodology: A cross-sectional survey of LFTs was undertaken in 2011 in a rural population cohort in South-Western Uganda. We classified abnormal LFTs based on reference ranges set in America and in Africa. We derived fibrosis scores (AST to Platelet Ratio Index, fibrosis-4, GGT to platelet ratio, red cell distribution width to platelet ratio, and S-index) to evaluate the potential prevalence of liver disease. We collected information about alcohol intake, and infection with HIV, HBV and HCV, to determine the contribution made by these factors to liver inflammation or fibrosis. Results: Data were available for 8,099 participants (median age 30 years; 56% female). The prevalence of HBV, HCV and HIV infection were 3%, 0.2% and 8%, respectively. The prevalence of abnormal LFTs was higher based on the American reference range compared to the African reference range (e.g. for AST 13% vs 3%, respectively). The prevalence of AST/ALT ratio >2 was 11%, suggestive of alcoholic hepatitis. The highest prevalence of fibrosis was suggested by the GPR score, with 24% of the population falling above the threshold for fibrosis. By multivariate analysis, elevated LFTs and fibrosis scores were most consistently associated with older age, male sex, being under-weight, infection with HIV or HBV, and alcohol consumption. Based on population attributable risk, the highest proportion of elevated fibrosis scores was associated with alcohol use (e.g. 64% of elevated S-index scores). Conclusion: Further work is required to determine normal reference ranges for LFTs in this setting, to evaluate the specificity and sensitivity of fibrosis scores, and to determine aetiology of liver disease.","O'hara, G.; Mokaya, J.; Hau, J. P.; Downs, L. O.; Mcnaughton, A. L.; Karabarinde, A.; Asiki, G.; Seeley, J.; Matthews, P. C.; Newton, R.",20190703,"Gastroenterology","10.1101/19000968",1,"Philippa C Matthews","Nuffield Department of Medicine, University of Oxford, Medawar Building for Pathogen Research,  South Parks Road, Oxford OX1 3SY, UK","https://www.medrxiv.org/content/10.1101/19000968v1?versioned=TRUE","https://www.medrxiv.org/content/10.1101/19000968v1.full.pdf","cc_by",NA,"All supporting data are accessible on-line via figshare (URL will be converted to a permanent DOI on acceptance of the paper). https://figshare.com/s/0b08de8a740991a7aa22",6
65,"A CALCIUM-RICH MULTI-MINERAL INTERVENTION TO MODULATE COLONIC MICROBIAL COMMUNITIES AND METABOLOMIC PROFILES IN HUMANS:Results from a 90-day trial","Aquamin, a calcium-, magnesium-, and multiple trace element-rich natural product has polyp prevention efficacy based on preclinical studies. The overall goal of this study was to determine the safety and tolerability of Aquamin when used as a dietary chemopreventative in humans. Additionally, we determined the effects of Aquamin on the colonic microbial community and attendant metabolomic profile. Thirty healthy male and female human participants were enrolled in a 90-day trial in which the effects of Aquamin (delivering 800 mg of calcium per day) were compared to those of calcium alone or placebo. Before and after the interventional period, colonic biopsies and stool specimens were obtained. All 30 participants completed the study without serious adverse events. There were no changes in liver function markers. Compared to pretreatment values, intervention with Aquamin led to a reduction in total bacterial DNA and a shift in the microbial community. Treatment with calcium alone also produced a decline in total bacteria, but smaller than seen with Aquamin, while no reduction was observed with placebo. In parallel with microbial changes, a reduction in bile acid levels and a slight increase in the level of the short chain fatty acid (SCFA) acetate in stool specimens from Aquamin-treated participants was noted. No change in bile acids or SCFAs was observed with calcium alone or placebo. We conclude from these studies that Aquamin is safe and tolerable in healthy human participants and may produce beneficial alterations in the colonic microbial community and the attendant metabolomic profile.","Aslam, M. N.; Bassis, C. M.; Bergin, I. L.; Knuver, K.; Zick, S.; Sen, A.; Turgeon, D. K.; Varani, J.",20190703,"Gastroenterology","10.1101/19001255",1,"Muhammad N Aslam","University of Michigan Medical School","https://www.medrxiv.org/content/10.1101/19001255v1?versioned=TRUE","https://www.medrxiv.org/content/10.1101/19001255v1.full.pdf","cc_no","10.1158/1940-6207.CAPR-19-0325","Microbial sequencing data will be available from the NCBI Sequence Read Archive database, accession number is pending.",4
66,"Misclassification of a whole genome sequence reference defined by the Human Microbiome Project: a detrimental carryover effect to microbiome studies","Taxonomic classification is an essential step in the analysis of microbiome data that depends on a reference database of whole genome sequences. Taxonomic classifiers are built on established reference species, such as the Human Microbiome Project database, that is growing rapidly. While constructing a population wide pangenome of the bacterium Hungatella, we discovered that the Human Microbiome Project reference species Hungatella hathewayi (WAL 18680) was significantly different to other members of this genus. Specifically, the reference lacked the core genome as compared to the other members. Further analysis, using average nucleotide identity (ANI) and 16s rRNA comparisons, indicated that WAL18680 was misclassified as Hungatella. The error in classification is being amplified in the taxonomic classifiers and will have a compounding effect as microbiome analyses are done, resulting in inaccurate assignment of community members and will lead to fallacious conclusions and possibly treatment. As automated genome homology assessment expands for microbiome analysis, outbreak detection, and public health reliance on whole genomes increases this issue will likely occur at an increasing rate. These observations highlight the need for developing reference free methods for epidemiological investigation using whole genome sequences and the criticality of accurate reference databases.","Bandoy, D. D. R.; Huang, B. C.; Weimer, B. C.",20190706,"Infectious Diseases","10.1101/19000489",1,"Bart C Weimer","UC Davis","https://www.medrxiv.org/content/10.1101/19000489v1?versioned=TRUE","https://www.medrxiv.org/content/10.1101/19000489v1.full.pdf","cc_no",NA,"The whole genome sequences are available now via the SRA for all bu, except BCW8888. It will be publically available within 90 days.",3
68,"Using collaboration networks to identify authorship bias in meta-analyses","Meta-analytic methods are powerful resources to summarize the existing evidence concerning a given research question, and are widely used in many academic fields. However, meta-analyses can be vulnerable to various sources of bias, which should be considered to avoid inaccuracies. Many of these sources can be related to study authorship, as both methodological choices and researcher bias may lead to deviations in results between different research groups. In this work, we describe a method to objectively attribute study authorship within a given meta-analysis to different research groups by using graph cluster analysis of collaboration networks. We then provide empirical examples of how the research group of origin can impact effect size in distinct types of meta-analyses, demonstrating how non-independence between within-group results can bias effect size estimates if uncorrected. Finally, we show that multilevel random-effects models using research group as a level of analysis can be a simple tool for correcting biases related to study authorship.","Moulin, T. C.; Amaral, O. B.",20191216,"Epidemiology","10.1101/19001305",2,"Thiago C Moulin","Uppsala University","https://www.medrxiv.org/content/10.1101/19001305v2?versioned=TRUE","https://www.medrxiv.org/content/10.1101/19001305v2.full.pdf","cc_by_nc",NA,"Both our data and code are available as supplementary material, along with instructions for using the code to construct the figures of our article.",5
69,"The effect of the genetic liability to autism spectrum disorder on emotion recognition in young unaffected probands from a population-based cohort","We investigated how ASD genetic risk relates to neurodevelopmental features (491 traits tested) via polygenic risk scoring (PRS) in 4,309 young non-ASD probands from the Philadelphia Neurodevelopmental Cohort. ASD PRS most strongly associated with the ability to correctly identify angry facial emotions in youths aged 11-17 years (R2=1.06%, p=1.38x10-7) and replicated similarly in older probands (>18 years) (R2=0.55%, p=0.036). The association in 11-to-17-year-old probands was independent of other psychiatric disorders, brain imaging phenotypes, and educational attainment. ASD PRS also associated with proband-reported emotionality and connectedness with others. The proband-reported irritability trait was highly correlated with angry facial emotion recognition (r2=0.159, p=2.74x10-5) but was independently associated with ASD PRS (R2=1.20%, p=1.18x10-4). Several informant-reported (i.e., typically mother-reported) traits were predicted by the proband ASD PRS, including duration of fear (R2=0.156%, p=0.001). These data indicate how genetic liability to ASD may influence neurodevelopment in the general population, especially the development of emotional intelligence.","Wendt, F. R.; Muniz Carvalho, C.; Gelernter, J.; Polimanti, R.",20190708,"Psychiatry And Clinical Psychology","10.1101/19001230",1,"Renato Polimanti","Yale School of Medicine","https://www.medrxiv.org/content/10.1101/19001230v1?versioned=TRUE","https://www.medrxiv.org/content/10.1101/19001230v1.full.pdf","cc_no",NA,"All data used in this study are either publicly available summary data or available for any research to submit an application through dbGAP.",4
70,"Intermittent Lactobacilli-containing Vaginal Probiotic or Metronidazole Use to Prevent Bacterial Vaginosis Recurrence: Safety and Preliminary Efficacy by Microscopy and Sequencing","Bacterial vaginosis (BV) is associated with HIV acquisition and adverse pregnancy outcomes. Recurrence after metronidazole treatment is high. HIV-negative, non-pregnant Rwandan BV patients were randomized to four groups (n=17/group) after seven-day oral metronidazole treatment: behavioral counseling only (control), or counseling plus intermittent use of oral metronidazole, Ecologic Femi+ vaginal capsule (containing multiple Lactobacillus and one Bifidobacterium species), or Gynophilus LP vaginal tablet (L. rhamnosus 35) for two months. Vaginal microbiota assessments at all visits included Gram stain Nugent scoring and 16S rRNA gene qPCR and HiSeq sequencing. All interventions were safe. BV (Nugent 7-10) incidence was 10.18 per person-year at risk in the control group, and lower in the metronidazole (1.41/person-year; p=0.004), Ecologic Femi+ (3.58/person-year; p=0.043), and Gynophilus LP groups (5.36/person-year; p=0.220). In mixed effects models adjusted for hormonal contraception/pregnancy, sexual risk-taking, and age, metronidazole and Ecologic Femi+ users, each compared to controls, had higher Lactobacillus and lower BV-anaerobes concentrations and/or relative abundances, and were less likely to have a dysbiotic vaginal microbiota type by sequencing. Inter-individual variability was high and effects disappeared soon after intervention cessation. Lactobacilli-based vaginal probiotics warrant further evaluation because, in contrast to antibiotics, they are not expected to negatively affect microbiota or cause antimicrobial resistance.","Van De Wijgert, J.; Verwijs, M. C.; Agaba, S. K.; Bronowski, C.; Mwambarangwe, L.; Uwineza, M.; Lievens, E.; Nivoliez, A.; Ravel, J.; Darby, A.",20190708,"Sexual And Reproductive Health","10.1101/19001156",1,"Janneke Van De Wijgert","Institute of Infection and Global Health, University of Liverpool, Liverpool, UK","https://www.medrxiv.org/content/10.1101/19001156v1?versioned=TRUE","https://www.medrxiv.org/content/10.1101/19001156v1.full.pdf","cc_by_nc_nd","10.1038/s41598-020-60671-6","All data will be made available via the University of Liverpool Data Research Catalogue (https://datacat.liverpool.ac.uk/) with publication of the manuscript in a peer-reviewed journal. We prefer to do this after peer-review because the peer-review may result in additional analyses. The most essential data are included in the manuscript and in Supplements 1 and 2. ",3
71,"Cluster analysis successfully identifies clinically meaningful knee valgus moment patterns: Frequency of early peaks reflects sex-specific ACL injury incidence","Background: Biomechanical studies of ACL injury risk factors report heterogenous results, analyze only a fraction of the data, and do not analyze data in accordance with the injury mechanism. Extracting a peak value of relevance to ACL injuries is challenging due to differences in the relative timing of the peak value. Aims/Hypotheses: The aim was to cluster analyze the knee valgus moment time series curve shape in the early stance phase. We hypothesized that 1a) There would be few discrete curve shapes, 1b) there would be an early peak pattern, 2a) youth athletes of both sexes would show similar frequencies of early peaks, 2b) adolescent girls would have higher early peak frequencies. Methods: N=213 (39% boys) youth soccer and team handball athletes (phase 1) and N=35 (45% boys) with 5 year follow-up data (phase 2) were recorded performing a change of direction task with 3D motion analysis and a force plate. The time series of the first 30% of stance phase were cluster analyzed based on Euclidean distances in two steps; shape-based main clusters with a transformed time series, and magnitude based sub-clusters with body weight normalized time series. Group differences (sex, phase) in curve shape frequencies, and shape-magnitude frequencies were tested with chi-squared test. Results: 6 discrete shape-clusters and 14 magnitude based sub-clusters were formed. Phase 1 boys had higher frequencies of early peaks than phase 1 girls (38% vs 25% respectively, P<0.001 for full test). Phase 2 girls had higher frequencies of early peaks than phase 2 boys (42% vs 21% respectively, P<0.001 for full test). Conclusions: Cluster analysis can reveal different patterns of curve shapes in biomechanical data. The early peak shape is relatable to the ACL injury mechanism as the timing of its peak moment is consistent with the timing of injury. Higher frequency of early peaks demonstrated by Phase 2 girls is consistent with their higher incidence of ACL injury.","Sigurthsson, H. B.; Briem, K.",20190708,"Sports Medicine","10.1101/19001511",1,"Haraldur Björn Sigurðsson","University of Iceland","https://www.medrxiv.org/content/10.1101/19001511v1?versioned=TRUE","https://www.medrxiv.org/content/10.1101/19001511v1.full.pdf","cc_by_nc_nd","10.1186/s40634-019-0205-5","A number of decisions have to be made by the authors during data processing and analysis. The field of cluster analysis has not reached consensus on how to select many important parameters during the cluster analysis process, including the number of clusters. In order to facilitate replication and auditing of the results presented, a data set that can be used to replicate the cluster analysis will be uploaded at datadryad.org should the manuscript be accepted. The data set includes the R code used to perform the cluster analysis. The data is uploaded as additional documents for submission in JEO. ",3
