"ID","title","abstract","authors","date","category","doi","version","author_corresponding","author_corresponding_institution","link_page","link_pdf","license","published","data_avail","decision"
103,"Quantification of Conflicts of Interest in an Online Point-of-Care Clinical Support Website","Online medical reference websites are utilized by health care providers to enhance their education and decision making. However, these resources may not adequately reveal pharmaceutical-author interactions and their potential conflicts of interest (CoIs). This investigation: 1) evaluated the correspondence of two well-utilized CoI databases: the Centers for Medicare and Medicaid Services Open Payments (CMSOP) and ProPublica Dollars for Docs (PDD) and 2) quantified CoIs among authors of a publically available point of care clinical support website. Two data sources were used: the hundred most common drugs and the top fifty causes of death. These topics were entered into a freely available database. The authors (N = 139) were then input into CMSOP and PDD and compensation and number of payment were determined for 2013-2015. The subset of highly compensated authors that also reported quote: Nothing to disclose, unquote, were further examined. There was a high degree of similarity between CMSOP and PDD for compensation (R2 > 0.998) and payment number (R2 > 0.992). The amount received was 1.4% higher in CMSOP ($4,059,194) than in PDD ($4,002,891). The articles where the authors had received the greatest compensation were in neurology (Parkinsons Disease = $1,810,032), oncology (Acute Lymphoblastic Leukemia = $616,727), and endocrinology (Type I Diabetes = $377,388). Two authors reporting Nothing to disclose received appreciable and potentially relevant compensation. CMSOP and PDD produced almost identical results. CoIs were common among authors but self-reporting may be an inadequate reporting mechanism. Recommendations are offered for improving the CoI transparency of pharmaceutical-author interactions in point-of-care electronic resources.","Chopra, A. C.; Tilberry, S.; Sternat, K. E.; Chung, D. Y.; Nichols, S. D.; Piper, B. J.",20190714,"Medical Ethics","10.1101/19001859",1,"Brian J Piper","Geisinger Commonwealth School of Medicine","https://www.medrxiv.org/content/10.1101/19001859v1?versioned=TRUE","https://www.medrxiv.org/content/10.1101/19001859v1.full.pdf","cc_by_nc_nd","10.1007/s11948-019-00153-9","The data is available as a supplemental file.",5
104,"Actigraphic Screening for Rapid Eye Movement Sleep Behavior Disorder","Background: The patients suffering of the rapid eye movement sleep behavior disorder (RBD) are in high risk of developing a neurodegenerative disorder, most frequently from the group of alpha-synucleinopathies, such as Parkinson's disease (PD), Dementia with Lewy Bodies (DLB) or multiple system atrophy (MSA). The definitive diagnosis of RBD is based on polysomnographic investigation. Actigraphy is much easier to perform and reflects condition in patient's home environment. The aims: The aim of this study was to find suitable biomarkers for RBD, which can be detectable by actigraphic recording. Methods: High resolution actigraphic recording (MotionWatch, CamNtech ltd.) and confirming polysomnographic recording was performed on 45 RBD patients, 30 patients with other sleep-related motor disorders and 20 healthy controls. Each individual file was analysed by software testing for amount of sleep (MotionWare 1.1.20) and secondly for periodic motor activity (PLMS analysis 1.0.16). The 13-item patient self-rating RBD screening questionnaire (RBD-SQ) translated to Czech language was also used for screening purposes. We used an RBD-SQ score of five points as a positive test result, as suggested by the original publication of the scale. Results: When using the actigraphic sleep detection, we encountered significant differences mostly on non-dominant hand, related to sleep fragmentation - most notably increased percentage of Short immobile bouts (47.0% vs. 28.0%, p<0.0001), increased Fragmentation index (72.5 vs. 40.7, p<0.0001) and decreased percentage of Sleep efficiency (72.1% vs. 86.8%, p<0.0001)in RBD subjects compared to other sleep disorders and controls. When analyzing periodic motor activity, we also found surprisingly more periodic hand movements (p=0.028, corrected for multiple testing), but differences on lower extremities using either measurement were not significant. The discrimination function based on RBD-SQ and Short immobile bouts % could allocate correctly the RBD status in 87.6% of cases with Wilks Lambda 0.435 and p<0.0001. Conclusion: In our single-center study in patients from the Czech population, we found that actigraphic recording from upper extremities shows consistently more prominent sleep fragmentation in RBD patients compared to other sleep diagnoses or healthy controls. Actigraphy may be useful in broader screening for RBD.","Sandala, K.; Dostalova, S.; Nepozitek, J.; Ibarburu, V.; Dusek, P.; Ruzicka, E.; Sonka, K.; Kemlink, D.",20190714,"Neurology","10.1101/19001867",1,"David Kemlink","First Faculty of Medicine, Charles University in Prague","https://www.medrxiv.org/content/10.1101/19001867v1?versioned=TRUE","https://www.medrxiv.org/content/10.1101/19001867v1.full.pdf","cc_no",NA,"The datasets used and analysed during the current study are available from the corresponding author upon reasonable request",2
108,"Mediterranean Diet and atherothrombosis biomarkers: a randomized controlled trial","Following a Traditional Mediterranean diet (TMD) decreases cardiovascular risk. However, its anti-thrombotic effects are unexplored. We aimed to assess whether this diet improved platelet, coagulation, and fibrinolysis-related biomarkers in cardiovascular risk subjects. In 358 random PREDIMED Study volunteers (Prevencion con Dieta Mediterranea), we assessed: 1) 1-year effects on thrombosis of TMD, enriched in virgin olive oil (TMD-VOO; N=120) or nuts (TMD-Nuts; N=119), versus a low-fat diet (N=119), and 2) associations between 1-year biomarker changes and increments in Mediterranean Diet adherence and key food group intakes. TMD-Nuts attenuated pro-thrombotic status (P=0.029), whilst TMD-VOO did it in a marginally significant way (P=0.076). TMD-VOO decreased HDL-bound alpha1-antitrypsin levels (HDL pro-inflammatory/pro-thrombotic properties, P=0.034) and increased HDL platelet activating factor-acetylhydrolase activity (P=0.024). TMD-Nuts diminished non-esterified fatty acid levels (P=0.034). Only the low-fat diet was associated with increased platelet factor-4 concentrations (P=0.012) and thrombin activation (higher prothrombin factor1+2 levels, P=0.003) versus baseline. 2-point TMD adherence increments were linked to 10.2 mg/dL fibrinogen decrements (P=0.011). 1-serving increments in vegetable intake were associated with platelet factor-4 concentration decreases (-9.21%, P=0.031). 1-portion increments in fruit and fatty fish consumption were linked to thrombin generation decrements (-7.72% -P=0.007- and -13.2% -P=0.046-, respectively). Increases in antithrombin levels were related to 1-serving increments in nut intake (+2.34%, P=0.033) and reductions in processed meat consumption (+2.00%, P=0.018). Finally, 1-portion decreases in processed meat intake were associated with reduced plasminogen activator inhibitor-1 levels (-10.4%, P=0.008). Summarizing, TMD and its typical food items were associated with improved thrombosis biomarkers in high cardiovascular risk individuals.","Hernaez, A.; Castaner, O.; Tresserra-Rimbau, A.; Pinto, X.; Fito, M.; Casas, R.; Martinez-Gonzalez, M. A.; Corella, D.; Salas-Salvado, J.; Lapetra, J.; Gomez-Gracia, E.; Aros, F.; Fiol, M.; Serra-Majem, L.; Ros, E.; Estruch, R.",20200415,"Nutrition","10.1101/19001909",4,"Alvaro Hernaez","August Pi i Sunyer Biomedical Research Institute (IDIBAPS), Barcelona","https://www.medrxiv.org/content/10.1101/19001909v4?versioned=TRUE","https://www.medrxiv.org/content/10.1101/19001909v4.full.pdf","cc_no",NA,"Considering that we do not have the explicit written consent of the study volunteers to yield their deidentified data at the conclusion of the study, individual participant data cannot be shared. The study protocol is available in the main publication of the study1 and in the study website (http://www.predimed.es/uploads/8/0/5/1/8051451/_1estr_protocol_olf.pdf), and a summary of the dietary intervention is also available in Supplemental Methods.",1
109,"Effects of vitamin D supplementation and seasonality on circulating cytokines in adolescents: analysis of data from a feasibility trial in Mongolia.","Vitamin D deficiency is prevalent in human populations and has been linked to immune dysfunction. Here we explored the effects of cholecalciferol supplementation on circulating cytokines in severely vitamin D deficient (blood 25(OH)D3 << 30 nmol/L) adolescents aged 12-15 from Mongolia. The study included 28 children receiving 800 IU daily cholecalciferol for 6 months spanning winter and spring, and 30 children receiving placebo during the same period. The levels of 25(OH)D3 were assessed at baseline, three and six months. Twenty-one cytokines were measured in serum at baseline and at six months. The median blood 25(OH)D3 concentration at baseline was 13.7 nmol/L (IQR=10.0-21.7). Supplementation tripled blood 25(OH)D3 levels (p<0.001) and reversed the direction of change for most cytokines (16/21, 86%). Supplementation was associated with elevated interleukin (IL)-6 (p=0.043). The placebo group had reduced MIP-1 (p=0.007) and IL-8 (p=0.034) at six months. These findings suggest that cholecalciferol supplementation and seasonality have a measurable impact on circulating cytokines in adolescents, identifying chemokines as potentially important biomarkers of vitamin D status in this population.","Yegorov, S.; Bromage, S.; Boldbaatar, N.; Ganmaa, D.",20190714,"Nutrition","10.1101/19001842",1,"Sergey Yegorov","Suleyman Demirel University","https://www.medrxiv.org/content/10.1101/19001842v1?versioned=TRUE","https://www.medrxiv.org/content/10.1101/19001842v1.full.pdf","cc_by_nc_nd","10.3389/fnut.2019.00166","All data generated or analyzed during this study are included in this published article.",5
110,"Reproducibility and transparency characteristics of oncology research evidence","Introduction: As much as 50%-90% of research is estimated to be irreproducible, costing upwards of $28 billion in the United States alone. Reproducible research practices are essential to improving the reproducibility and transparency of biomedical research, such as including pre-registering studies, publishing a protocol, making research data and metadata publicly available, and publishing in open access journals. Here we report an investigation of key reproducible or transparent research practices in the published oncology literature. Methods: We performed a cross-sectional analysis of a random sample of 300 oncology studies published from 2014-2018. We extracted key reproducibility and transparency characteristics in a duplicative fashion by blinded investigators using a pilot tested Google Form. Results: Of the 300 studies randomly sampled, 296 studies were analyzed for study reproducibility characteristics. Of these 296 studies, 194 were contained empirical data that could be analyzed for reproducible and transparent research practices. Raw data was available for 9 studies (4.6%). Approximately 5 studies (2.6%) provided a protocol. Despite our sample including 15 clinical trials and 7 systematic reviews/meta-analyses, only 7 included a pre-registration statement. Less than 25% (65/194) of studies provided an author conflict of interest statement. Discussion: We found that key reproducibility and transparency characteristics were absent from a random sample of published oncology studies. We recommend required pre-registration for all eligible trials and systematic reviews, published protocols for all manuscripts, and deposition of raw data and metadata in public repositories.","Walters, C. G.; Harter, Z. J.; Wayant, C.; Vo, N.; Warren, M.; Chronister, J.; Tritz, D.; Vassar, M.",20190714,"Oncology","10.1101/19001917",1,"Corbin G Walters","Oklahoma State University Center for Health Sciences","https://www.medrxiv.org/content/10.1101/19001917v1?versioned=TRUE","https://www.medrxiv.org/content/10.1101/19001917v1.full.pdf","cc_by",NA,"Study protocol, raw data, and other pertinent materials are available on the Open Science Framework (https://osf.io/x24n3/). https://osf.io/x24n3/",6
111,"Redefining typhoid diagnosis: what would an improved test need to look like?","Introduction: Typhoid fever is one of the most common bacterial causes of acute febrile illness in the developing world, with an estimated 10.9 million new cases and 116.8 thousand deaths in 2017. Typhoid point-of-care (POC) diagnostic tests are widely used but have poor sensitivity and specificity, resulting in antibiotic overuse that has led to the emergence and spread of multidrug resistant strains. With recent advances in typhoid surveillance and detection, this is the ideal time to produce a target product profile (TPP) that guides product development and ensure that a next-generation test meets the needs of users in the resource-limited settings where typhoid is endemic. Methods: A structured literature review was conducted to develop a draft TPP for a next-generation typhoid diagnostic test with minimal and optimal desired characteristics for 36 test parameters. The TPP was refined using feedback collected from a Delphi survey of key stakeholders in clinical medicine, microbiology, diagnostics and public and global health. Results: A next-generation typhoid diagnostic test should improve patient management through the diagnosis and treatment of infection with acute Salmonella enterica serovars Typhi or Paratyphi with a sensitivity [&ge;]90% and specificity [&ge;]95%. The test would ideally be used at the lowest level of the healthcare system in settings without a reliable power or water supply and provide results in less than 15 minutes at a cost of <$1.00 USD. Conclusion: This report outlines the first comprehensive TPP for typhoid fever and is intended to guide the development of a next-generation typhoid diagnostic test. An accurate POC test will reduce the morbidity and mortality of typhoid fever through rapid diagnosis and treatment and will have the greatest impact in reducing antimicrobial resistance if it is combined with diagnostics for other causes of acute febrile illness in a treatment algorithm.","Mather, R.; Hopkins, H.; Parry, C.; Dittrich, S.",20190714,"Infectious Diseases","10.1101/19001958",1,"Richard Mather","London School of Hygiene and Tropical Medicine","https://www.medrxiv.org/content/10.1101/19001958v1?versioned=TRUE","https://www.medrxiv.org/content/10.1101/19001958v1.full.pdf","cc_by","10.1136/bmjgh-2019-001831","All data can be made available.",9
114,"Earliest infections predict the age distribution of seasonal influenza A cases","Seasonal variation in the age distribution of influenza A cases suggests that factors other than age shape susceptibility to medically attended infection. We ask whether these differences can be partly explained by protection conferred by childhood influenza infection, which has lasting impacts on immune responses to influenza and protection against new influenza A subtypes (phenomena known as original antigenic sin and immune imprinting). Fitting a statistical model to data from studies of influenza vaccine effectiveness (VE), we find that primary infection appears to reduce the risk of medically attended infection with that subtype throughout life. This effect is stronger for H1N1 compared to H3N2. Additionally, we find evidence that VE varies with both age and birth year, suggesting that VE is sensitive to early exposures. Our findings may improve estimates of age-specific risk and VE in similarly vaccinated populations and thus improve forecasting and vaccination strategies to combat seasonal influenza.","Arevalo, P.; Mclean, H. Q.; Belongia, E. A.; Cobey, S.",20200329,"Epidemiology","10.1101/19001875",3,"Philip Arevalo","Department of Ecology and Evolution, Univeristy of Chicago","https://www.medrxiv.org/content/10.1101/19001875v3?versioned=TRUE","https://www.medrxiv.org/content/10.1101/19001875v3.full.pdf","cc_by_nc_nd",NA,"Data for this study are available at www.github.com/cobeylab/FluAImprinting https://github.com/cobeylab/FluAImprinting",6
115,"Ethnicity and Acculturation: Asian American Substance Use from Early Adolescence to Mature Adulthood","Research on Asian American substance use has, to date, been limited by monolithic conceptions of Asian identity, inadequate attention to acculturative process, and a disproportionate focus on the adolescent developmental period. This study addresses these limitations by longitudinally investigating disparities in substance use, including tobacco, alcohol, cannabis, and a range of illicit drugs, from early adolescence (~15) into mature adulthood (~40) using five waves of the National Longitudinal Study of Adolescent to Adult Health (Add Health). Ample statistical power (Asian N=1583, obs=7915) allowed disaggregated study of the most populous Asian American ethnic groups including Chinese, Filipino, Korean, Vietnamese, Asian Indian, and Japanese, as well as subjects identifying as multiple Asian ethnicities (i.e., multiethnic) and multiracial Asians. The potential mediating role of acculturative factors (e.g., nativity, parental nativity, familial language use) on the observed ethnic disparities was also examined. Results indicate significant variation across Asian ethnicities, with the lowest probability of substance use among Chinese and Vietnamese, and the highest among multiethnic and multiracial Asians. Acculturative factors (e.g., English language use, nativity) were strongly associated with increased substance use, and mediated some, but not all, of the observed ethnic disparities. This study demonstrates how the model minority stereotype masks significant ethnic disparities in Asian American substance use and argues that a considerable proportion of the observed ethnic variation appears to be due to diverse family ties speeding transition toward US cultural norms, away from the relatively salubrious norms of Asian nations of origin.","Ahmmad, Z.; Adkins, D. E.",20190714,"Epidemiology","10.1101/19002048",1,"Daniel E Adkins","University of Utah","https://www.medrxiv.org/content/10.1101/19002048v1?versioned=TRUE","https://www.medrxiv.org/content/10.1101/19002048v1.full.pdf","cc_no",NA,"This research uses data from Add Health, a program project directed by Kathleen Mullan Harris and designed by J. Richard Udry, Peter S. Bearman, and Kathleen Mullan Harris at the University of North Carolina at Chapel Hill, and funded by grant P01-HD31921 from the Eunice Kennedy Shriver National Institute of Child Health and Human Development, with cooperative funding from 23 other federal agencies and foundations. Special acknowledgment is due to Ronald R. Rindfuss and Barbara Entwisle for assistance in the original design. Information on how to obtain the Add Health data files is available on the Add Health website (http://www.cpc.unc.edu/addhealth). No direct support was received from grant P01-HD31921 for this analysis.",4
117,"Childhood immune imprinting to influenza A shapes birth year-specific risk during seasonal H1N1 and H3N2 epidemics","Across decades of co-circulation in humans, influenza A subtypes H1N1 and H3N2 have caused seasonal epidemics characterized by different age distributions of cases and mortality. H3N2 causes the majority of relatively severe, clinically attended cases in high-risk elderly cohorts, and the majority of overall deaths, whereas H1N1 causes fewer deaths overall, and cases shifted towards young and middle-aged adults. These contrasting age profiles may result from differences in childhood exposure to H1N1 and H3N2 or from differences in evolutionary rate between subtypes. Here we analyze a large epidemiological surveillance dataset to test whether childhood immune imprinting shapes seasonal influenza epidemiology, and if so, whether it acts primarily via immune memory of a particular influenza subtype or via broader immune memory that protects across subtypes. We also test the impact of evolutionary differences between influenza subtypes on age distributions of cases. Likelihood-based model comparison shows that narrow, within-subtype imprinting shapes seasonal influenza risk alongside age-specific risk factors. The data do not support a strong effect of evolutionary rate, or of broadly protective imprinting that acts across subtypes. Our findings emphasize that childhood exposures can imprint a lifelong immunological bias toward particular influenza subtypes, and that these cohort-specific biases shape epidemic age distributions. As a result, newer and less ""senior"" antibody responses acquired later in life do not provide the same strength of protection as responses imprinted in childhood. Finally, we project that the relatively low mortality burden of H1N1 may increase in the coming decades, as cohorts that lack H1N1-specific imprinting eventually reach old age.","Gostic, K. M.; Bridge, R.; Brady, S.; Viboud, C.; Worobey, M.; Lloyd-Smith, J. O.",20190926,"Epidemiology","10.1101/19001834",2,"Katelyn M Gostic","Dept. of Ecology and Evolutionary Biology, University of California, Los Angeles, Los Angeles, CA, USA","https://www.medrxiv.org/content/10.1101/19001834v2?versioned=TRUE","https://www.medrxiv.org/content/10.1101/19001834v2.full.pdf","cc_by","10.1371/journal.ppat.1008109","All data analyzed in this study, and all code necessary to perform analyses and generate figures, is freely available and archived in the Zenodo repository https://zenodo.org/badge/latestdoi/160883450. (Clearly labeled subdirectories contain the data). https://zenodo.org/badge/latestdoi/160883450",6
122,"Pain in clients attending a South African voluntary counselling and testing centre was frequent and extensive but did not depend on HIV status.","Background: The frequency of pain is reported to be high in people living with HIV (PLWH), but valid comparisons between PLWH and HIV-negative cohorts are rare. We investigated whether HIV infection influenced frequency and characteristics of pain in adults undergoing voluntary testing for HIV. Methods: Participants were recruited from a HIV voluntary counselling and testing (VCT) centre at the Chris Hani Baragwanath Academic Hospital, Soweto, South Africa. Pain was assessed using the Wisconsin Brief Pain Questionnaire. Depressive and anxiety symptomatology was determined using the Hopkins Symptom checklist-25. We then stratified by HIV status. Results: Data from 535 black South Africans were analysed: HIV-infected n=70, HIV uninfected n=465. Overall, frequency of pain was high with 59% (95%CI: 55; 63, n: 316/535) of participants reporting pain, with no difference related to HIV status: HIV-infected 50% (95% CI: 37; 61, n: 35/70), HIV-uninfected 60% (95%CI: 56; 65, n: 281/465). Pain intensity and number of pain sites were similar between the groups as were symptoms of anxiety and depression: mean HSCL-25 1.72 (95% CI 1.57; 1.87) HIV-infected participants and 1.68 (95% CI: 1.63; 1.73) HIV-uninfected participants. Univariate analysis showed female sex and greater depressive and anxiety symptomatology associated with having pain. In a conservative multivariable model, only depressive and anxiety symptomatology was retained in the model. Conclusion: The high frequency of pain found in both HIV infected and uninfected individuals presenting at a VCT centre was more likely to be associated with depression and anxiety, than with the presence or absence of HIV.","Wadley, A. L.; Lazarus, E.; Gray, G. E.; Mitchell, D.; Kamerman, P. R.",20190715,"Hiv Aids","10.1101/19001784",1,"Peter R Kamerman","University of the Witwatersrand","https://www.medrxiv.org/content/10.1101/19001784v1?versioned=TRUE","https://www.medrxiv.org/content/10.1101/19001784v1.full.pdf","cc_by",NA,"Study participants did not consent to the public release of their data. However, the data are available on request from Peter Kamerman (peter.kamerman@wits.ac.za or peter.kamerman@gmail.com). https://github.com/kamermanpr/HIV-pain-VCT.git",2
